{
  "schema_version": "1.0.0",
  "corpus_ref": {
    "corpus_id": "learnpilot-rag-real-world-corpus",
    "corpus_version": "v1"
  },
  "anchor_count": 89,
  "anchors": [
    {
      "evidence_id": "ev-rw-bge-capabilities",
      "document_id": "rw-rag-bge-m3",
      "locator": {
        "kind": "SOURCE_LINES",
        "source_path": "evals/rag_real_world_corpus/v1/corpus/rw-rag-bge-m3.md",
        "start_line": 3,
        "end_line": 6,
        "section_title": "BGE-M3 introduction",
        "region": "early"
      },
      "anchor_text_hash": "c5e197662e114a6915488398e66b9b67abc7cefa0ec7a2da976301273149533e",
      "excerpt": "In this project, we introduce BGE-M3, which is distinguished for its versatility in Multi-Functionality, Multi-Linguality, and Multi-Granularity. - Multi-Functionality: It can simultaneously perform the three common retrieval functionalities of embedding model: dense retrieval, multi-vector retrieval, and sparse retrieval. - Multi-Linguality: It can support more than 100 working languages. - Multi-Granularity: It ...",
      "language": "en",
      "notes": "Frozen source representation; hash covers the complete normalized locator text."
    },
    {
      "evidence_id": "ev-rw-bge-pipeline",
      "document_id": "rw-rag-bge-m3",
      "locator": {
        "kind": "SOURCE_LINES",
        "source_path": "evals/rag_real_world_corpus/v1/corpus/rw-rag-bge-m3.md",
        "start_line": 10,
        "end_line": 21,
        "section_title": "Suggestions for retrieval pipeline in RAG",
        "region": "early"
      },
      "anchor_text_hash": "5dee7f35807b2494f11f2bbf7233b043e3ceeb42b1c2e720f05f04c824c8ec5d",
      "excerpt": "**Some suggestions for retrieval pipeline in RAG** We recommend to use following pipeline: hybrid retrieval + re-ranking. - Hybrid retrieval leverages the strengths of various methods, offering higher accuracy and stronger generalization capabilities. A classic example: using both embedding retrieval and the BM25 algorithm. Now, you can try to use BGE-M3, which supports both embedding and sparse retrieval. This al...",
      "language": "en",
      "notes": "Frozen source representation; hash covers the complete normalized locator text."
    },
    {
      "evidence_id": "ev-rw-bge-miracl-correction",
      "document_id": "rw-rag-bge-m3",
      "locator": {
        "kind": "SOURCE_LINES",
        "source_path": "evals/rag_real_world_corpus/v1/corpus/rw-rag-bge-m3.md",
        "start_line": 24,
        "end_line": 38,
        "section_title": "News",
        "region": "early"
      },
      "anchor_text_hash": "081eee3daeb58c142b292eb832c37573d8088bf747e7c7257855b8389d9a197c",
      "excerpt": "## News: - 2024/7/1: **We update the MIRACL evaluation results of BGE-M3**. To reproduce the new results, you can refer to: [bge-m3_miracl_2cr](https://huggingface.co/datasets/hanhainebula/bge-m3_miracl_2cr). We have also updated our [paper](https://arxiv.org/pdf/2402.03216) on arXiv. <details> <summary> Details </summary> > The previous test results were lower because we mistakenly removed the passages that have ...",
      "language": "en",
      "notes": "Frozen source representation; hash covers the complete normalized locator text."
    },
    {
      "evidence_id": "ev-rw-bge-specs",
      "document_id": "rw-rag-bge-m3",
      "locator": {
        "kind": "SOURCE_LINES",
        "source_path": "evals/rag_real_world_corpus/v1/corpus/rw-rag-bge-m3.md",
        "start_line": 42,
        "end_line": 53,
        "section_title": "Specs",
        "region": "early"
      },
      "anchor_text_hash": "a6e25219680dd3d03855888dc4be1e380ba273f8e8c5d70d8d4ec9be0d866c3f",
      "excerpt": "## Specs - Model | Model Name | Dimension | Sequence Length | Introduction | |:----:|:---:|:---:|:---:| | [BAAI/bge-m3](https://huggingface.co/BAAI/bge-m3) | 1024 | 8192 | multilingual; unified fine-tuning (dense, sparse, and colbert) from bge-m3-unsupervised| | [BAAI/bge-m3-unsupervised](https://huggingface.co/BAAI/bge-m3-unsupervised) | 1024 | 8192 | multilingual; contrastive learning from bge-m3-retromae | | [B...",
      "language": "en",
      "notes": "Frozen source representation; hash covers the complete normalized locator text."
    },
    {
      "evidence_id": "ev-rw-bge-methods",
      "document_id": "rw-rag-bge-m3",
      "locator": {
        "kind": "SOURCE_LINES",
        "source_path": "evals/rag_real_world_corpus/v1/corpus/rw-rag-bge-m3.md",
        "start_line": 64,
        "end_line": 70,
        "section_title": "FAQ: different retrieval methods",
        "region": "early"
      },
      "anchor_text_hash": "09deae8299455c7fe6e545e2c31d87874c0d6bd557a3d0f5a7a3a4f8b97cafea",
      "excerpt": "## FAQ **1. Introduction for different retrieval methods** - Dense retrieval: map the text into a single embedding, e.g., [DPR](https://arxiv.org/abs/2004.04906), [BGE-v1.5](https://github.com/FlagOpen/FlagEmbedding) - Sparse retrieval (lexical matching): a vector of size equal to the vocabulary, with the majority of positions set to zero, calculating a weight only for tokens present in the text. e.g., BM25, [unic...",
      "language": "en",
      "notes": "Frozen source representation; hash covers the complete normalized locator text."
    },
    {
      "evidence_id": "ev-rw-bge-no-query-instruction",
      "document_id": "rw-rag-bge-m3",
      "locator": {
        "kind": "SOURCE_LINES",
        "source_path": "evals/rag_real_world_corpus/v1/corpus/rw-rag-bge-m3.md",
        "start_line": 73,
        "end_line": 79,
        "section_title": "FAQ: use in other projects",
        "region": "middle"
      },
      "anchor_text_hash": "16e08df7a06e6d607c43503744891a7c0bdbe60ee2b78afe56273feed6a2bbc6",
      "excerpt": "**2. How to use BGE-M3 in other projects?** For embedding retrieval, you can employ the BGE-M3 model using the same approach as BGE. The only difference is that the BGE-M3 model no longer requires adding instructions to the queries. For hybrid retrieval, you can use [Vespa](https://github.com/vespa-engine/pyvespa/blob/master/docs/sphinx/source/examples/mother-of-all-embedding-models-cloud.ipynb ) and [Milvus](http...",
      "language": "en",
      "notes": "Frozen source representation; hash covers the complete normalized locator text."
    },
    {
      "evidence_id": "ev-rw-bge-dense-usage",
      "document_id": "rw-rag-bge-m3",
      "locator": {
        "kind": "SOURCE_LINES",
        "source_path": "evals/rag_real_world_corpus/v1/corpus/rw-rag-bge-m3.md",
        "start_line": 109,
        "end_line": 132,
        "section_title": "Generate Embedding for text: Dense Embedding",
        "region": "middle"
      },
      "anchor_text_hash": "fcacc497a7c5c6723579166bc2269a7634ee26d19a6c3aa08fff5041b0ed85e5",
      "excerpt": "### Generate Embedding for text - Dense Embedding ```python from FlagEmbedding import BGEM3FlagModel model = BGEM3FlagModel('BAAI/bge-m3', use_fp16=True, devices=['cuda:0']) # Setting use_fp16 to True speeds up computation with a slight performance degradation sentences_1 = [\"What is BGE M3?\", \"Defination of BM25\"] sentences_2 = [\"BGE M3 is an embedding model supporting dense retrieval, lexical matching and multi-...",
      "language": "en",
      "notes": "Frozen source representation; hash covers the complete normalized locator text."
    },
    {
      "evidence_id": "ev-rw-bge-sparse-usage",
      "document_id": "rw-rag-bge-m3",
      "locator": {
        "kind": "SOURCE_LINES",
        "source_path": "evals/rag_real_world_corpus/v1/corpus/rw-rag-bge-m3.md",
        "start_line": 136,
        "end_line": 162,
        "section_title": "Sparse Embedding (Lexical Weight)",
        "region": "middle"
      },
      "anchor_text_hash": "296425c464540e2d72ea3abd3de3a0bc2ab5e0af74f89766b59dd8b1087a7f5d",
      "excerpt": "- Sparse Embedding (Lexical Weight) ```python from FlagEmbedding import BGEM3FlagModel model = BGEM3FlagModel('BAAI/bge-m3', use_fp16=True) # Setting use_fp16 to True speeds up computation with a slight performance degradation sentences_1 = [\"What is BGE M3?\", \"Defination of BM25\"] sentences_2 = [\"BGE M3 is an embedding model supporting dense retrieval, lexical matching and multi-vector interaction.\", \"BM25 is a b...",
      "language": "en",
      "notes": "Frozen source representation; hash covers the complete normalized locator text."
    },
    {
      "evidence_id": "ev-rw-bge-score-weights",
      "document_id": "rw-rag-bge-m3",
      "locator": {
        "kind": "SOURCE_LINES",
        "source_path": "evals/rag_real_world_corpus/v1/corpus/rw-rag-bge-m3.md",
        "start_line": 184,
        "end_line": 207,
        "section_title": "Compute score for text pairs",
        "region": "deep"
      },
      "anchor_text_hash": "99f3b0917dfea4d9838525bee5d8d1a3854ed12d90b92fc2b9679a4f818909eb",
      "excerpt": "### Compute score for text pairs Input a list of text pairs, you can get the scores computed by different methods. ```python from FlagEmbedding import BGEM3FlagModel model = BGEM3FlagModel('BAAI/bge-m3', use_fp16=True) sentences_1 = [\"What is BGE M3?\", \"Defination of BM25\"] sentences_2 = [\"BGE M3 is an embedding model supporting dense retrieval, lexical matching and multi-vector interaction.\", \"BM25 is a bag-of-wo...",
      "language": "en",
      "notes": "Frozen source representation; hash covers the complete normalized locator text."
    },
    {
      "evidence_id": "ev-rw-bge-long-eval",
      "document_id": "rw-rag-bge-m3",
      "locator": {
        "kind": "SOURCE_LINES",
        "source_path": "evals/rag_real_world_corpus/v1/corpus/rw-rag-bge-m3.md",
        "start_line": 224,
        "end_line": 252,
        "section_title": "Evaluation: Our results",
        "region": "deep"
      },
      "anchor_text_hash": "e4e1906943d1aa4dbadf42ed5c059c942abb659bd00ec501b3034de44acf8ca1",